,Label,String,clean_text,encoded_label
1795,negative,Mata ku sepet baca koment fans ubul empang ..minggir woy bikin rusuh aja nih jaer amis jijik sumpah.soal enji sm cewek lain ttp aja bala jaer nyampah bikin ribut .,mata aku sepet baca koment fans ubul empang minggir woy bikin rusuh saja nih jaer amis jijik sumpah enji sama cewek tetap saja bala jaer nyampah bikin ribut,0
1796,negative,"Ini siapa sih si enji, hartis kah ? Males banget jijik laki model beginian mah gak ada tanggung jwbnya. Ayu bunting di tinggalin anak gak di akuin, skrg anak udh nongol bilqis cantek eh sampek bini nya ngeposting yg seolah enji kangen anaknya. Najonggg jijik betoll.. Dah deh min gak usah di bahas lagi laki macam begini, hartis aja bukan gak ada panutan yg bisa di ambil  <USERNAME>",sih si enji hartis kah males sekali jijik laki model mah tidak tanggung jwbnya ayu bunting tinggalin anak tidak akuin sekarang anak sudah nongol bilqis cantek eh sampek bini nya ngeposting yang enji kangen anaknya najonggg jijik betoll sudah deh min tidak bahas laki hartis saja tidak panutan yang ambil username,0
1797,negative," <USERNAME> bego nya lagi pede amat ngomong seolah yg dia bilang paling bener, padahal bukti aja kaga ada. Mau keliatan pinter jatohnya bego??",username bodoh nya pede bicara yang bilang benar bukti saja kaga kelihatan pintar jatohnya bodoh,0
1798,negative,Yang pada bilang enji ganteng bebas slingkuh bego kali. Ganteng pala lu bau menyan. Gada ganteng ganteng nya. Kebanyakan gaya kek mantan bini depok nya.,bilang enji ganteng bebas slingkuh bodoh kali ganteng pala kamu bau menyan tidak ada ganteng ganteng nya kebanyakan gaya kek mantan bini depok nya,0
1799,negative,"Sebenarnye cocok enji sama att, sama sama GATEEEEL hahah pantesan si tongtong dipertemukan dgn enji, udh hukum alam klw jodoh kita cerminan diri kita, nah si entong hrsnya bekaca dgn masa lalu biar sadar tp teryata otak 1 M tetep mau di pertahankan jd skrg mlh menjadi jadi guatelnye, sama aja kek enji, hah",sebenarnye cocok enji att gateeeel hahah pantas si tongtong dipertemukan dengan enji sudah hukum alam kalau jodoh cerminan si entong hrsnya bekaca dengan biar sadar tetapi teryata otak 1 m tetap pertahankan jadi sekarang malah guatelnye saja kek enji hah,0
1800,negative," <USERNAME> oalaahhh,, semakin banyak aja pelakor ?? laki nya jg kegatelan, tp namanya laki ibarat kucing di ksh ikan jaer gratis ya kga nolak wkwkkwkw",username oalaahhh saja pelakor laki nya juga kegatelan tetapi namanya laki kucing kasih ikan jaer gratis ya tidak tolak wkwkkwkw,0
1801,negative,"Begitulah laki2 ya sis, lebih suka pecun2 murahan, daripada prempuan baik2 berjilbab ato pintar. Enji2, kok downgrade sih? Dari pedangdut naik kelas prempuan berjilbab ehh milih sama pecun lagi.. jeleknya seleramu",laki2 ya sis suka pecun2 murahan prempuan baik2 berjilbab atau pintar enji2 downgrade sih pedangdut kelas prempuan berjilbab ehh pilih pecun jeleknya seleramu,0
1802,negative,Motorninja aj songong amat mba org yg punya mobil lamborgini aj biasa wae kok ????????,motorninja saja songong mba orang yang mobil lamborgini saja wae,0
1803,negative,GoBlOk ?????? gua nonton berkali kaget juga ??,goblok saya nonton berkali kaget,0
1804,negative,"Ga usa pake anjing, babi!! ?????? kalo gw bls gitu wkwk",tidak usa pakai anjing babi kalau saya balas begitu wkwk,0
1805,negative,Oh ini toh yang kemaren TIDAK MENGHARGAI KARYA ORANG DAN SEENAKNYA BILANG JELEK BANGET... Aduh itu penganten perempuan nya KEKENYANGAN yah... Ampe kembung gitu perut nya... #pepuraLuGU,oh kemarin menghargai karya orang bilang jelek sekali aduh penganten perempuan nya kekenyangan yah sampai kembung begitu perut nya pepuralugu,0
1806,negative,"Dari awal percaya gimik Raffi gigi dn att...sehingga att peserta keluarga di hujad dn anak ny...di hujad ...semakin kesini penonton semakin di bodohin?? semakin publik tertuju mereka ??????yg kasihan para penghujad ....ga apa"" lah ayu ga ada di pesbukers biar dia ngeluarkn album"" baru single baru setelah para artis halan"" keluar nengri gimik"" apa lagi yoo",percaya gimik raffi gigi dan att att peserta keluarga hujad dan anak nya hujad kesini penonton bodohin publik yang kasihan penghujad tidak ayu tidak pesbukers biar ngeluarkn album single artis halan nengri gimik yoo,0
1807,negative,"Kalo bener gimmick, bodoh banget si ayu cuma demi rating n popularitas berani taruhin harga dirinya buat di nilai buruk oleh mata masyarakat ????",kalau benar gimmick bodoh sekali si ayu rating n popularitas berani taruhin harga nilai buruk mata masyarakat,0
1808,negative,Susah otaknya diemvang mah bikin rusuh dilapak orang,susah otaknya diemvang mah bikin rusuh dilapak orang,0
1809,negative,najiiisss kayak si mba dese ga gitu ajaaa. hahahahaha maling teriak maling. ngaca buuuuuk,najiiisss mirip si mba dese tidak begitu ajaaa hahahahaha maling teriak maling ngaca buuuuuk,0
1810,negative, <USERNAME> IYAK KAA HAHAHAHAH geli bgt gasih sama att ih kampung abis:(((,username iyak kaa hahahahah geli sangat gasih att ih kampung habis,0
1811,negative,"JOGETNYA BIKIN NGAKAKKK ANJIRRRR, KAMPUNGAN BANGET??????  <USERNAME>  <USERNAME>",jogetnya bikin ngakakkk anjirrrr kampungan sekali username username,0
1812,negative,Bagus la gue berarti ada otak gak kayak lu malu maluin mak lu aja tong akun asli di pake tu yg namanya bego!  <USERNAME>,bagus la saya otak tidak mirip kamu malu maluin mak kamu saja tong akun asli pakai itu yang namanya bodoh username,0
1813,negative,"Yg bego mah elu, ibu mana sih yg mau ngasih contoh buruk ke anaknya , pake mata lo, emg ada di dugem bawa anak , bego sih -_- jaman udah texas , dan gue jamin dijaman anaknya jga pasti udh lebih texas . Selagi ga ngerugiin lo yaudah . Sewot banget .",yang bodoh mah elu sih yang kasih contoh buruk anaknya pakai mata kamu memang dugem bawa anak bodoh sih _ jaman sudah texas saya jamin dijaman anaknya juga sudah texas selagi tidak ngerugiin kamu yaudah sewot sekali,0
1814,negative,"Si wanita jahiliyah.. Lesbi , skrg udh py pacar lg. Kasian anaknya. Kmrn di ksh bencana slnya dia tega misahin anak dr bapak nya, dia ktakutan anak nya masuk islam pdhl bp nya g prnh nuntut anaknya memeluk islam. Udh di ksh nikmat anak 3 org, msh aja begajulan.",si wanita jahiliyah lesbi sekarang sudah py pacar lagi kasihan anaknya kemarin kasih bencana slnya tega misahin anak dari nya ktakutan anak nya masuk islam padahal bp nya tidak pernah nuntut anaknya memeluk islam sudah kasih nikmat anak 3 orang masih saja begajulan,0
1815,negative, <USERNAME> gw tanya. Emang kador artis beneran? Komen lo tolol sumpah. Masa harus kenal dia buat nilai dia artis atau bukan. Hahaha semua org indo jg pasti setuju kalo kador bukan artis tp cuma celebgram dr kampung. Lo tau kan bedanya artis dg selebgra,username saya memang kador artis benar komen kamu tolol sumpah kenal nilai artis hahaha orang indo juga setuju kalau kador artis tetapi celebgram dari kampung kamu tahu bedanya artis dengan selebgra,0
1816,negative, <USERNAME> hahahaaaa trs gue tanya. Lo tolol? PAke nanya kador bencong atau ngga padahal blm kenal wkwkwkwkw. Eh semua org jg bisa nilai si kador bencong beneran dr gerak gerik melambay suara ngondek dan pake baju cewek begitu nyaman. Mana ada cowok tu,username hahahaaaa terus saya kamu tolol pakai tanya kador bencong tidak belum kenal wkwkwkwkw eh orang juga nilai si kador bencong benar dari gerak gerik melambay suara ngondek pakai baju cewek nyaman cowok itu,0
1817,negative," <USERNAME> maklumin shaaay... Fans gatis keras itu otaknya bebel, realita seperti apa jg ga bakalan dia terima... Seperti halnya nagita itu artis uda dr jaman dia kecil eh di bilang numpang tenar ke rapi mamad,pdhl kan yg jadiin si mamad gede y PH n",username maklumin shaaay fans gatis keras otaknya bebel realita juga tidak terima halnya nagita artis sudah dari jaman eh bilang numpang tenar rapi mamad padahal yang jadi si mamad gede y ph n,0
1818,negative, <USERNAME>.bee idih najong lu tag2 org! Nimbrung aja kek mujaer lo! Dia ga bakal terkenal klo ga bawa2 nama ayu ting ting sm nagita! Duh bego dipiara! Kesian,username bee idih najong kamu tag2 orang nimbrung saja kek mujaer kamu tidak terkenal kalau tidak bawa2 nama ayu ting ting sama nagita duh bodoh dipiara kasihan,0
1819,negative,"langsung saja bilang siapa yg di maksud, klu gini namanya MUNAFIK!",langsung bilang yang maksud kalau gini namanya munafik,0
1820,negative,"Jedar emg muka 2 kali, didepan baik, dibelakang busuk, mulutnya kek banci cucoklah 2 banci tu",jedar memang muka 2 kali di depan di belakang busuk mulutnya kek banci cucoklah 2 banci itu,0
1821,negative,AMIT AMIT DEH ORANG JAHAT... PENJILAT PEMBOHONG PELAKOR JIJIK BANGET,amit amit deh orang jahat penjilat pembohong pelakor jijik sekali,0
1822,negative,"Wkwkwkwk... Ya Allah ya Tuhan ku knp lah org2 munafik ni tp sok suci, mulan jamela kan ayu ting2 ngikuti jejak a bukan? Wkwkwk  <USERNAME>",wkwkwkwk ya allah ya tuhan aku kenapa orang-orang munafik ni tetapi sok suci mulan jamela ayu ting2 ngikuti jejak a wkwkwk username,0
1823,negative,"Dlu si pelakor ini yg sombong krn brhasil dapetin si botak smpe mnceraikan bunda maya,skrg hdp ny mkin anjlok malah bunda maya yg sring jelong2 kluarnegri..??????",dulu si pelakor yang sombong karena brhasil mendapatkan si botak sampai mnceraikan bunda maya sekarang hdp nya mkin anjlok bunda maya yang sering jelong2 kluarnegri,0
1824,negative,Hahhahaha dan sesungguhnya allah swt melaknat wanita perebut dan pezina dengan suami sah oranglain ????????,hahhahaha sesungguhnya allah swt melaknat wanita perebut pezina suami sah oranglain,0
1825,negative,"@w.lina2706 hemmmm capekmiskin sist, skrg blik kere lg jd artis jg g laku, dah lah karma tu pasti ada...  <USERNAME> dr pada sirik nyinyirin nyonya, tuh bantuin jualan cireng nya tuh, cilok nya tuh untunnya buat liburan monaco, jangan bromo trus",w lina2706 hemmmm capekmiskin sist sekarang balik kere lagi jadi artis juga tidak laku sudah karma itu username dari sirik nyinyirin nyonya tuh bantuin jualan cireng nya tuh cilok nya tuh untunnya liburan monaco bromo terus,0
1826,negative,Kepo juga sm nyonyiah lu jongos  <USERNAME> emng tetehlu pas hamil peak udeh dinikahin ?? Brojol anak br di sirih EMNG LONTEEEEE kelas akun jamahliur dan junjungan hehe ??????,kepo sama nyonyiah kamu jongos username memang tetehlu pas hamil peak sudah dinikahin brojol anak baru sirih memang lonteeeee kelas akun jamahliur junjungan hehe,0
1827,negative,"Eh jongos cba gue duluan yg nanya sm lu .. emng nyonyiah ada gembar gembor udah nikah.. adakah nyonyiah ngaku udeh nikah ???? Dr pada tetehlu yg lonte perek itu tiba"" brojol dan ngaku nikah siri sm laki nyonyiah dan hamidun sapeak anak ilegal dibilng FITNA KEJI haha lonte menolak lupa xixix ??????  <USERNAME>",eh jongos cba saya duluan yang tanya sama kamu memang nyonyiah gembar gembor sudah nikah adakah nyonyiah ngaku sudah nikah dari tetehlu yang lonte perek brojol ngaku nikah siri sama laki nyonyiah hamidun sapeak anak ilegal dibilng fitna keji haha lonte menolak lupa xixix username,0
1828,negative," <USERNAME> sini gua jawab currr ya bunmai sdh pernah nikah Tp sekarang janda dia janda karena suami nya di rampas Mulan jameela,menjijikkan banget ya Mulan jameela sblm rmh tangga bunmai hancur sdh berani bilang Dani suami bersama aduha udh wanita be",username saya currr ya bunmai sudah nikah tetapi janda janda suami nya rampas mulan jameela menjijikkan sekali ya mulan jameela sebelum rumah tangga bunmai hancur sudah berani bilang dani suami aduha sudah wanita be,0
1829,negative,"@w.lina2706  <USERNAME> lucu aja ya sist, lonte di bela2 mati2an... Guoblok di pelihara, di bayar berapa gt sama muljamban, sampe bikin account  <USERNAME> mau maia nikah atau blm nikah apa urusan situ, kelihatan nyinyirnya sirik nya. Sekarang balik",w lina2706 username lucu saja ya sist lonte bela2 mati2an guoblok pelihara bayar begitu muljamban sampai bikin account username maia nikah belum nikah urusan situ nyinyirnya sirik nya,0
1830,negative,"Yaela muljem kyak stu bner aja. Gag inget apa udh ngrusak kbhagian klwrga org. Bego d prtahanin y gini ini,",yaela muljem seperti stu benar saja gag ingat sudah ngrusak kbhagian klwrga orang bodoh di prtahanin y gini,0
1831,negative,Banyak lakik doyan banci! Jadi banci & kawinin banci.... jijik!,lakik suka banci banci kawinin banci jijik,0
1832,negative," <USERNAME> itu comment yg tidak anda lihat, ada brp banyak. Jangan jadi pengguna medsos yg bodoh jangan asal bunyi. Situ sehat pakai hijab masi nyinyir aja??",username comment yang lihat berapa pengguna medsos yang bodoh bunyi situ sehat pakai hijab masi nyinyir saja,0
1833,negative," <USERNAME> malu tuh sama kerudung kamu sayang, sama ibadah nya. Sholat aja drpd nyinyirin org dandanan udh sok suci mulut nya kaya sampah??",username malu tuh kerudung sayang ibadah nya sholat saja daripada nyinyirin orang dandanan sudah sok suci mulut nya kaya sampah,0
1834,negative," <USERNAME> tolong di baca arti dr comment saya, udah kerdus+bodoh lg bilangin org tua nya besok kalo masak jangan pakai mecin, jd udah kerdungab ga sesuai mulut. Besok makan salmon kalo g mampu besok aku tak deliv ke rumahmu .",username tolong baca arti dari comment sudah kerdus bodoh lagi bilangin orang tua nya besok kalau masak pakai mecin jadi sudah kerdungab tidak sesuai mulut besok makan salmon kalau tidak besok deliv rumahmu,0
1835,negative,"Maaf mukanya jelek terus attitude nya buruk,,spesialis plagiat,,dan ketauan pula ,,,",maaf mukanya jelek attitude nya buruk spesialis plagiat ketauan,0
1836,negative,"ini orang otaknya ga pernah di sekolahin ya? itu resiko ketika udah upload sesuatu di sosmed, ya pasti bakal dapet perbincangan dari netizen. public figure kok ga ada otaknya.",orang otaknya tidak sekolahin ya resiko sudah upload sosmed ya dapat perbincangan netizen public figure tidak otaknya,0
1837,negative,Artis kampungan wkwk,artis kampungan wkwk,0
1838,negative,"Iyaaa gue pernah pacaran? Udah nikah malah, tapi gak seNORAK eloo.. Gak risih emang? Jgn asal aplod, Perhatiin followers lu yg lumayan banyak itu, tar kebawa norak.",iyaaa saya pacaran sudah nikah tidak senorak eloo tidak risih memang jangan aplod perhatiin followers kamu yang lumayan tar terbawa norak,0
1839,negative,y ampun pnyanyi dangdut kurang tenar songong bangt BACOTNYA ??pngn nyari sensasi tapi kmpungan bangt deh amit amit bool ko d instastory,y ampun pnyanyi dangdut tenar songong bangt bacotnya ingin cari sensasi kmpungan bangt deh amit amit bool ko di instastory,0
1840,negative,Waaaaoooo..sopan sekali.. bahasami menunjukkan kelasmu !!! Heeeehh.. yg repot ama hidup lu siapahh ?? Elu live nampilin hal2 gak penting..yg nggilanikk.. menjijikkan..diliat org banyak.. ya pantes lah dikomen..klo gak mw dikomen videoin pribadi aja.. nonton sendiri lu ama kluarga lu di rmh.. nambah lagi niy ertong yg gak pny attutude!! Kampungan!!,waaaaoooo sopan bahasami kelasmu heeeehh yang repot ama hidup kamu siapahh elu live nampilin hal2 tidak yang nggilanikk menjijikkan diliat orang ya pantes dikomen kalau tidak mau dikomen videoin pribadi saja nonton kamu ama keluarga kamu rumah tambah niy ertong yang tidak punya attutude kampungan,0
1841,negative,"Norak sih,kayak ga ada malunya.kl dia bilang terserah dia,ya udah,simpan fotonya.gak perlu dibagi kesemua orang.lah ini dipamer kemana,resikolah dinyinyiri orang.Insecure banget,kudu ya pamer2 gitu biar semua orang ngerti kl si mbaknya udh py pacar yg bisa dipamer2 pantatnya?Kampung bgt",norak sih mirip tidak malunya kalau bilang terserah ya sudah simpan fotonya tidak dibagi kesemua orang dipamer ke mana resikolah dinyinyiri orang insecure sekali kudu ya pamer2 begitu biar orang ngerti kalau si mbaknya sudah py pacar yang dipamer2 pantatnya kampung sangat,0
1842,negative,Koq marah sehhh???dasar wanita kampungan...??,kok marah sehhh dasar wanita kampungan,0
1843,negative,Kampungan.... Artis yg numpang tenar gara2 mukanya mirip Katy Perry doang,kampungan artis yang numpang tenar gara2 mukanya katy perry doang,0
1844,negative,Susah kalo artis kampung,susah kalau artis kampung,0
1845,negative,"Ah min, gue lama2 gak suka sama akun ini nih! Berita nya basi! Lo liat dong min.. itu si kellen sama amora lagi dateng.. pake ikut jingkrak2 kok!! Lo saring dulu dong min.. biar berita nya gak blunder.. lo posting juga tu KD udah posting videon kellen ma amora lagi joget2 ma si arsya arsyi!!",ah min saya lama2 tidak suka akun nih berita nya basi kamu liat min si kellen amora datang pakai jingkrak2 kamu saring min biar berita nya tidak blunder kamu posting itu kd sudah posting videon kellen ma amora joget2 ma si arsya arsyi,0
1846,negative," <USERNAME> iya""km bening, kelewat bening jadi buluk kan ya mbak ?? mbaknya baru nelen apasih komen kaya gini? Apa baru kesurupan ?",username iya kamu bening kelewat bening buluk ya mbak mbaknya telan apasih komen kaya gini kesurupan,0
1847,negative,"kita sekeluarga sangat ngefans dan kagum lihat  <USERNAME> semua nya deh.tapi lihat anak nya yg jelek,buluk kan.  <USERNAME>.hermansyah  <USERNAME> kutuk kan apa yg menimpa bunda KD untung Allah swt sudah menggantikan amora dan adik nya.gemezzzzzzz lihat nya cocok banget jadi Anak artis se class bunda KD ??????",sekeluarga ngefans kagum lihat username nya deh lihat anak nya yang jelek buluk username hermansyah username kutuk yang menimpa bunda kd untung allah swt menggantikan amora adik nya gemezzzzzzz lihat nya cocok sekali anak artis class bunda kd,0
1848,negative,Emang dasar si anak nya aja yg lebay....urusan pribadi di umbar..biar di blow up... hadehh..gunanya whatsapp sms or telp buat apa..suka aneh....,memang dasar si anak nya saja yang lebay urusan pribadi umbar biar blow up hadehh gunanya whatsapp sms or telp suka aneh,0
1849,negative,"Coba liat bibir mu sayang, seperti pantat ayam. Wajah mu bulukan seperti kentut?? perfectoooo?",coba liat bibir mu sayang pantat ayam wajah mu bulukan kentut perfectoooo,0
1850,negative,Gagal fokus dengar suaranya.. koq jengkel ya dengernya... sorry cuman manusia biasa kalo jengkel????,gagal fokus dengar suaranya kok jengkel ya dengernya sorry hanya manusia kalau jengkel,0
1851,negative,"Muljem ngomong gak jelas blepotan, gak nyadar mau idup enak aja pake rebut laki orang dulu",muljem bicara tidak blepotan tidak nyadar hidup enak saja pakai rebut laki orang,0
1852,negative,??lucu ya si yg bikin kata2.bawa2 Tuhan.kalau dah kepepet. Masa dia ga tau ibarat apa org yg merusak rumah tangga org.ibarat merobohkan bangunan masjid mbak nya.bayangin aja seberapa besar nya dosa mu.nasi dah jdi bubur mba nya moga bisa bahagia di dunia.??,lucu ya si yang bikin kata2 bawa2 tuhan sudah kepepet tidak tahu orang yang merusak rumah tangga orang merobohkan bangunan masjid mbak nya bayangin saja nya dosa mu nasi sudah jadi bubur mba nya semoga bahagia dunia,0
1853,negative,Iyah bener. Tidak Akan merubah pandangan Tuhan terhadap Kita. Terutama elu Setan!! Makanya mikirrrr.. suami majikan kok diembat!!,iyah benar merubah pandangan tuhan elu setan mikirrrr suami majikan diembat,0
1854,negative,Gilingan mulan jalang lg kasih ceramah. Hahahaha . dasar cireng gak tau diri gak pernah ngaca. Si cireng lg ceramah sok2 kyk pahlawan kesiangan biar bisa berteman ama sekuter kyk selpii ini.,gilingan mulan jalang lagi kasih ceramah hahahaha dasar cireng tidak tahu tidak ngaca si cireng lagi ceramah sok2 seperti pahlawan kesiangan biar berteman ama sekuter seperti selpii,0
1855,negative,"Ya pandangan Tuhan terhadap lo juga jelek sih gue rasa, dikira perebut suami orang tuh mulia apa dimata Tuhan?????????",ya pandangan tuhan kamu jelek sih saya perebut suami orang tuh mulia dimata tuhan,0
1856,negative,"Karna sejatinya kau adalah setan berwujud manusia ,,karna pekerjaan setan ya menggoda manusia ????",karena sejatinya kamu setan berwujud manusia karena pekerjaan setan ya menggoda manusia,0
1857,negative,Pernah ngga mba  <USERNAME> baca ada netizen yg nyesel ga bs nimpuk telor ke si mulan..gw aja ketawa bacanya krn terwakili. Ya ngapain buang2 wktu ketemu orang gak mutu dng si mulan...msh untung nyempet2in bs nuli? disini biar nyadar tuh pelakor ga punya harga diri. Mending ketemu org baik2 spt bunmai...ketularan aura positifnya.,tidak mba username baca netizen yang menyesal tidak bisa nimpuk telur si mulan saya saja tertawa bacanya karena terwakili ya ngapain buang2 waktu ketemu orang tidak mutu dengan si mulan masih untung nyempet2in bisa nuli biar nyadar tuh pelakor tidak harga mending ketemu orang baik2 seperti bunmai ketularan aura positifnya,0
1858,negative,Editanx paraaaahh...oplas aj laaah nyai drpd ngedit2 gn hahaa kn maluuu,editanx paraaaahh oplas saja laaah nyai daripada ngedit2 gn hahaa kan maluuu,0
1859,negative,"jelek,lecek,bantet ??????",jelek lecek bantet,0
1860,negative,Gini amat pengen tenar ya ampuuun...malu kalo jadi anaknya yah kasian,gini pengen tenar ya ampuuun malu kalau anaknya yah kasihan,0
1861,negative,"Heran gw mak  <USERNAME> knp dia masih aja di pake ma AN*V di pesbu**r. Kasus ny bederet, skandal bertubi2.... Gk ada malu ny ?? muka tembok ?? sangat gak ada faedah ny nonton acara yg ada si manusia kardus ini ??",heran saya mak username kenapa saja pakai ma an v pesbu r nya bederet skandal bertubi2 tidak malu nya muka tembok tidak faedah nya nonton acara yang si manusia kardus,0
1862,negative,"wey org goblok juga bisa bedain vape, shisha sm rokok. jelas jelas lo ngerokok pake acara ga ngaku segala",wey orang goblok bedain vape shisha sama rokok kamu merokok pakai acara tidak ngaku,0
1863,negative,Jijik saya liatnya...kaya ulet bulu kluget2 gitu...hihihi..ampe sgitunya pengen terkenal...!!,jijik liatnya kaya ulet bulu kluget2 begitu hihihi sampai sgitunya pengen terkenal,0
1864,negative,Jablay anjir mukanya... Murahan bangetttt najisss,jablay anjir mukanya murahan bangetttt najisss,0
1865,negative," <USERNAME>.alycia iya sist jijik banget gw liatnya sok suci ngatain orang kalo gw sih malulah artis papan atas tapi otak gak di fikir kalo ngomong ,ketauan bngt gada wibawanya kalo emang dia nyadar dia siapa seharusnya dia tau cara berkomentar manusia gada yg ",username alycia iya sist jijik sekali saya liatnya sok suci ngatain orang kalau saya sih malulah artis papan otak tidak fikir kalau bicara ketauan sangat tidak ada wibawanya kalau memang nyadar tahu berkomentar manusia tidak ada yang,0
1866,positive,yang sabar yaa.. insya Allah menjadi pembuka pintu syurga dan penghalang api neraka bagi kedua orang tuanya,sabar yaa insya allah pembuka pintu syurga penghalang api neraka orang tuanya,1
1867,positive,Lagu barunya mbak tata kan kisah nyatanya rumah tangga mbak tata.... jadi rasanya mbak tata bener2 sayang get sama suaminya... syukur kalau baikan.... semoga awet...,lagu barunya mbak tata kisah rumah tangga mbak tata mbak tata benar-benar sayang get suaminya syukur baikan semoga awet,1
1868,positive,"Yg komen kenapa si mbak ini ga sedih malah ketawa2.. ya iyalah klo kita dah disakiti sm pasangan smpe berlarut2 ngapain juga sih kita sedih ampe depresi segala.. serahin sm Allah aja..bawa happy aja mski sakit.. lagian si mba senyum2 di wajahnya tp hatinya mana tau kan... senyumannya bs jd buat menetralisir kondisi hatinya yg lg terpuruk... ada pepatah bilang ,, klo bahagia jgn trllu bahagia, klo sedih juga jgn trllu sedih... diimbangi aja biar ga gila ??????",yang komen si mbak tidak sedih ketawa2 ya iyalah kalau sudah disakiti sama pasangan sampai berlarut2 ngapain sih sedih sampai depresi serahin sama allah saja bawa happy saja mski sakit si mba senyum2 wajahnya tetapi hatinya tahu senyumannya bisa jadi menetralisir kondisi hatinya yang lagi terpuruk pepatah bilang kalau bahagia jangan trllu bahagia kalau sedih jangan trllu sedih diimbangi saja biar tidak gila,1
1869,positive,"Suka banget sama pasangan satu ini. Semoga gigi dan raffi menjadi keluarga sakinnah, mawaddah, warrahmah. Semoga tidak ada pihak2 yang ingin memisahkan mereka. Jodoh sampai maut memisahkan. Amiin",suka sekali pasangan semoga gigi raffi keluarga sakinnah mawaddah warrahmah semoga pihak2 memisahkan jodoh maut memisahkan amin,1
1870,positive,"Jemima kan anak angkat celine, eleeya anak hubungan celine dan dirly. Dan saya terharu saya tau kalau jemima adalah anak panti asuhan yang dia rawat. Dan wajar kalau stefen lebih pilih celine karna hatinya baik",jemima anak angkat celine eleeya anak hubungan celine dirly terharu tahu jemima anak panti asuhan rawat wajar stefen pilih celine karena hatinya,1
1871,positive,Lucu yg blg stefan menghabiskn masa muda wkwk.umurnya mah gak muda mukanya aja yg baby face. Bersyukur.bonus buat celinenya?? lah dlu mantannya begimane. Dibawah umur ude pacran mcam laki bini. Hiks. Selepas tu yakin deh susah mengambil keputusan kaya stefan. Tipical cowo yg tnggung jwabnya tinggi,lucu yang bilang stefan menghabiskn muda wkwk umurnya mah tidak muda mukanya saja yang baby face bersyukur bonus celinenya dulu mantannya begimane dibawah umur ude pacran mcam laki bini hiks selepas itu deh susah mengambil keputusan kaya stefan tipical cowok yang tnggung jwabnya,1
1872,positive,Dan lagi ada yg masih bawa2 keenan ????. raisa udah paling berbahagia ngedapetin suami yang super ngemong dan mature kaya hamish. Raisa itu cukup dewasa di banding wanita seumurannya yang masih mikirin dirinya sendiri. Jd menurut gue raisa dan hamish sama2 beruntung bisa menjadi sepasang suami istri. Ga ada tuh gagal move on ???????? so congratz raisa dan hamish. Semoga pernikahannya sakinah mawadah dan warahmah,yang bawa2 keenan raisa sudah berbahagia ngedapetin suami super ngemong mature kaya hamish raisa dewasa banding wanita seumurannya memikirkan jadi saya raisa hamish sama2 beruntung sepasang suami istri tidak tuh gagal move on so congratz raisa hamish semoga pernikahannya sakinah mawadah warahmah,1
1873,positive,"Raisa cantik yaaa, meskipun artis tapi ga menonjolkan kalo nikah tuh harus mewah, udah cantik, sederhana, sempurna bgt,",raisa cantik yaaa artis tidak menonjolkan kalau nikah tuh mewah sudah cantik sederhana sempurna sangat,1
